{
  "$schema": "https://json-schema.org/draft/2020-12/schema",
  "x-contract-version": "0.1.0-proposed",
  "x-source-status": "LOCAL_OBSERVATION_NEEDS_MANUAL_REVIEW",
  "title": "Observed artifact key-set fixture descriptor",
  "description": "Validates metadata for local simulator-generated observations, not official artifact instances.",
  "type": "object",
  "additionalProperties": false,
  "required": [
    "artifact_family",
    "source",
    "observed_schema_version",
    "key_sets"
  ],
  "properties": {
    "artifact_family": {
      "enum": [
        "pre_game_declaration",
        "agreed_config",
        "game_log",
        "final_result"
      ]
    },
    "source": {
      "type": "object",
      "additionalProperties": false,
      "required": [
        "filename",
        "sha256",
        "evidence"
      ],
      "properties": {
        "filename": {
          "type": "string",
          "minLength": 1
        },
        "sha256": {
          "type": "string",
          "pattern": "^[0-9a-f]{64}$"
        },
        "evidence": {
          "const": "local simulator-generated artifact; NEEDS_MANUAL_REVIEW provenance"
        }
      }
    },
    "observed_schema_version": {
      "const": "1.1"
    },
    "key_sets": {
      "type": "object",
      "minProperties": 1,
      "additionalProperties": {
        "type": "array",
        "minItems": 1,
        "uniqueItems": true,
        "items": {
          "type": "string",
          "minLength": 1
        }
      }
    }
  }
}
