{
  "artifact_family": "agreed_config",
  "source": {
    "filename": "2-agreed-config.json",
    "sha256": "4e7778d88bf53aa2d4dad0ad09c64764149d3ed0e521e578e77a3ab75773cba1",
    "evidence": "local simulator-generated artifact; NEEDS_MANUAL_REVIEW provenance"
  },
  "observed_schema_version": "1.1",
  "key_sets": {
    "$": [
      "_schema",
      "schema_version",
      "_note",
      "agreed_between",
      "board_and_agents",
      "world",
      "movement_and_barriers",
      "scoring",
      "pheromones",
      "network_and_league",
      "rate_limiter_gatekeeper",
      "game_id",
      "game_uid",
      "sub_game_number",
      "links",
      "config_name",
      "config_sha256"
    ],
    "$.board_and_agents": [
      "grid_size",
      "num_agents",
      "thief_start",
      "cop_start",
      "axis_origin_corner",
      "axis_start_index",
      "_axis_note"
    ],
    "$.world": [
      "_note",
      "map_area",
      "hint_max_words",
      "_hint_max_words_note"
    ],
    "$.movement_and_barriers": [
      "move_set",
      "max_barriers",
      "max_moves",
      "survival_threshold"
    ],
    "$.scoring": [
      "capture_cop",
      "capture_thief",
      "survival_cop",
      "survival_thief",
      "tie_score",
      "technical_loss"
    ],
    "$.pheromones": [
      "pheromone_center_intensity",
      "pheromone_decay",
      "pheromone_grid_size",
      "pheromone_min_center_intensity"
    ],
    "$.network_and_league": [
      "response_timeout_sec",
      "watchdog_timeout_sec",
      "num_games",
      "diversity_reward",
      "min_games_to_pass",
      "max_games_per_team",
      "token_budget_per_series"
    ],
    "$.rate_limiter_gatekeeper": [
      "requests_per_minute",
      "concurrent_requests",
      "retry_backoff_sec",
      "max_retries",
      "queue_depth"
    ],
    "$.links": [
      "_remark",
      "declaration",
      "config",
      "log",
      "result"
    ]
  }
}
