{
  "artifact_family": "pre_game_declaration",
  "source": {
    "filename": "1-pre-game-declaration.json",
    "sha256": "f0f54ada41b831fc666d18ba0605f656ec4ac21160a85653553bda8e574543e4",
    "evidence": "local simulator-generated artifact; NEEDS_MANUAL_REVIEW provenance"
  },
  "observed_schema_version": "1.1",
  "key_sets": {
    "$": [
      "_schema",
      "schema_version",
      "declaration_type",
      "game_id",
      "game_uid",
      "links",
      "timezone",
      "game_started_at",
      "game_ended_at",
      "num_sub_games",
      "max_tokens_per_game",
      "groups"
    ],
    "$.links": [
      "_remark",
      "declaration",
      "config",
      "log",
      "result"
    ],
    "$.groups": [
      "*"
    ],
    "$.groups.*": [
      "group_id",
      "group_name",
      "members",
      "repos",
      "mcp_servers",
      "llm_model",
      "hardware_spec",
      "signature"
    ],
    "$.groups.*.repos": [
      "cop",
      "thief"
    ],
    "$.groups.*.mcp_servers": [
      "cop",
      "thief"
    ],
    "$.groups.*.hardware_spec": [
      "cpu_type",
      "cpu_freq_mhz",
      "cpu_cores",
      "ram_gb",
      "gpu_model",
      "vram_gb"
    ]
  }
}
